{
  "$schema": "https://raw.githubusercontent.com/otspace0715/hex-shogun-map/main/schemas/world.schema.json",
  "meta": {
    "world_id": "arcadia_continent",
    "name": "アルカディア大陸",
    "description": "魔法と剣の異世界。5つの王国が覇権を争う。",
    "version": "1.0.0"
  },
  "coordinate": {
    "origin_lat": 30.0,
    "origin_lng": 100.0,
    "lat_step": 0.030311,
    "lng_step": 0.0525,
    "note": "架空世界。lat/lngは名目上の値。col/rowが実質的な座標。",
    "coordinate_system": "grid",
    "cell_size_km": 50,
    "world_size": {
      "width_cells": 60,
      "height_cells": 40,
      "description": "60×40のヘックスグリッド世界"
    }
  },
  "api": {
    "province_base": "https://raw.githubusercontent.com/otspace0715/hex-shogun-map/main/arcadia_data/",
    "specials": "https://raw.githubusercontent.com/otspace0715/hex-shogun-map/main/arcadia/special_territories.json",
    "sea_routes": "https://raw.githubusercontent.com/otspace0715/hex-shogun-map/main/arcadia/sea_routes.json",
    "water_cells": "https://raw.githubusercontent.com/otspace0715/hex-shogun-map/main/arcadia/water_cells.json",
    "castles": "https://raw.githubusercontent.com/otspace0715/hex-shogun-map/main/arcadia/castles.json"
  },
  "terrain_types": {
    "0": {
      "name": "草原",
      "color": [
        70,
        130,
        60
      ],
      "passable": true,
      "capturable": true,
      "cost": 1.0
    },
    "1": {
      "name": "丘陵地",
      "color": [
        100,
        85,
        55
      ],
      "passable": true,
      "capturable": true,
      "cost": 2.0
    },
    "2": {
      "name": "禁足の山",
      "color": [
        55,
        45,
        70
      ],
      "passable": false,
      "capturable": false,
      "cost": 9.9
    },
    "3": {
      "name": "聖なる川",
      "color": [
        40,
        90,
        150
      ],
      "passable": true,
      "capturable": true,
      "cost": 3.0,
      "flood_risk": true
    },
    "4": {
      "name": "海岸",
      "color": [
        30,
        60,
        110
      ],
      "passable": true,
      "capturable": true,
      "cost": 1.0
    },
    "5": {
      "name": "魔の火山",
      "color": [
        200,
        60,
        20
      ],
      "passable": false,
      "capturable": false,
      "cost": 9.9
    },
    "6": {
      "name": "精霊の湖",
      "color": [
        50,
        100,
        180
      ],
      "passable": true,
      "capturable": true,
      "cost": 2.0
    },
    "7": {
      "name": "深海域",
      "color": [
        15,
        40,
        90
      ],
      "passable": false,
      "capturable": false,
      "cost": 9.9,
      "ship_only": true
    },
    "8": {
      "name": "要塞都市",
      "color": [
        180,
        140,
        30
      ],
      "passable": true,
      "capturable": true,
      "cost": 2.0
    },
    "9": {
      "name": "辺境地帯",
      "color": [
        60,
        58,
        65
      ],
      "passable": true,
      "capturable": true,
      "cost": 1.5
    }
  },
  "provinces": [
    {
      "id": "aur",
      "name": "黄金王国アウロス",
      "color": [
        200,
        160,
        40
      ],
      "region": "中央大陸"
    },
    {
      "id": "sil",
      "name": "銀月王国シルヴァ",
      "color": [
        150,
        180,
        200
      ],
      "region": "北方"
    },
    {
      "id": "ign",
      "name": "炎帝国イグニス",
      "color": [
        200,
        80,
        40
      ],
      "region": "南方"
    },
    {
      "id": "ver",
      "name": "翠森共和国ヴェルデ",
      "color": [
        60,
        160,
        80
      ],
      "region": "西方"
    },
    {
      "id": "mar",
      "name": "深海神聖マレア",
      "color": [
        40,
        100,
        180
      ],
      "region": "東方"
    },
    {
      "id": "umb",
      "name": "暗黒領主ウンブラ",
      "color": [
        80,
        40,
        120
      ],
      "region": "魔境"
    }
  ],
  "i18n": {
    "ui.select_region": "Choose a Kingdom",
    "ui.tap_cell": "Tap a cell",
    "ui.loading": "Loading…",
    "ui.error": "Error",
    "ui.cells": "cells",
    "ui.gps_searching": "📡 Locating…",
    "ui.gps_failed": "Location failed",
    "ui.gps_outside": "Outside the continent",
    "ui.gps_stop": "📡 Stop",
    "ui.gps_start": "📍 Locate",
    "ui.spawn_tap": "🏰 Choose spawn point",
    "ui.spawn_cancel": "✕ Cancel",
    "ui.spawn_set": "🏰 Set Base",
    "ui.normal_mode": "Normal mode",
    "ui.shared_edges": "shared edges",
    "ui.cost": "move cost",
    "ui.built": "founded",
    "ui.lord": "ruler",
    "cell.border": "⚔ Frontier",
    "cell.port": "⚓ Harbor",
    "cell.castle": "🏯 Fortress",
    "cell.sea": "🌊 Deep Sea",
    "cell.river": "〜 Sacred River",
    "cell.flood": "⚠ Flood risk",
    "cell.lake": "✨ Spirit Lake",
    "cell.sea_route": "⛵ Sea Lane",
    "cell.special": "⭐ Sacred Site",
    "cell.island": "🏝️ Isle",
    "cell.unknown_sea": "Deep Sea",
    "cell.unknown_lake": "Spirit Lake",
    "cell.unknown_river": "Sacred River",
    "cell.unknown_border": "Frontier",
    "cell.unknown_auto": "Deep Sea"
  }
}